{
  "version": "13.0",
  "description": "Mechanisms aligned to the nine Personal Wellness Blueprint body systems",
  "mechanisms": [
    {
      "id": "MEC001",
      "name": "Bile Acid Binding",
      "category": "Lipid Metabolism",
      "description": "Describes how soluble fibres and related compounds bind bile acids in the gut, increasing their excretion and prompting the liver to draw more cholesterol from the blood to make replacement bile acids.",
      "plainEnglish": "Helps remove cholesterol from the body by binding to bile acids in the gut.",
      "evidence": "Moderate",
      "primaryBodySystems": [
        "BS003"
      ],
      "maturity": "Established",
      "status": "Active"
    },
    {
      "id": "MEC002",
      "name": "Supports Healthy Cholesterol Metabolism",
      "category": "Lipid Metabolism",
      "description": "A broader mechanism covering the range of ways foods and compounds can influence cholesterol synthesis, absorption and clearance to support a healthy overall lipid profile.",
      "plainEnglish": "Helps keep cholesterol levels in a healthy range.",
      "evidence": "Moderate",
      "primaryBodySystems": [
        "BS003"
      ],
      "maturity": "Established",
      "status": "Active"
    },
    {
      "id": "MEC003",
      "name": "Supports Healthy Triglyceride Metabolism",
      "category": "Lipid Metabolism",
      "description": "Covers effects on the synthesis, transport and clearance of triglycerides, the main storage form of dietary fat in the blood.",
      "plainEnglish": "Helps keep blood fat (triglyceride) levels in a healthy range.",
      "evidence": "High",
      "primaryBodySystems": [
        "BS003"
      ],
      "maturity": "Established",
      "status": "Active"
    },
    {
      "id": "MEC004",
      "name": "Reduces Cholesterol Absorption",
      "category": "Lipid Metabolism",
      "description": "Describes compounds, such as plant sterols, that compete with dietary cholesterol for absorption in the small intestine, reducing the amount that enters the bloodstream.",
      "plainEnglish": "Reduces how much cholesterol from food gets absorbed into the body.",
      "evidence": "Moderate",
      "primaryBodySystems": [
        "BS003"
      ],
      "maturity": "Established",
      "status": "Active"
    },
    {
      "id": "MEC005",
      "name": "Supports HDL Maintenance",
      "category": "Lipid Metabolism",
      "description": "Covers effects on high-density lipoprotein (HDL) cholesterol, which transports cholesterol away from tissues to the liver for clearance.",
      "plainEnglish": "Helps maintain healthy levels of HDL, often called 'good' cholesterol.",
      "evidence": "Moderate",
      "primaryBodySystems": [
        "BS003"
      ],
      "maturity": "Established",
      "status": "Active"
    },
    {
      "id": "MEC006",
      "name": "Supports LDL Reduction",
      "category": "Lipid Metabolism",
      "description": "Covers effects that help lower low-density lipoprotein (LDL) cholesterol, the lipoprotein most closely associated with arterial plaque build-up.",
      "plainEnglish": "Helps lower LDL, often called 'bad' cholesterol.",
      "evidence": "High",
      "primaryBodySystems": [
        "BS003"
      ],
      "maturity": "Established",
      "status": "Active"
    },
    {
      "id": "MEC007",
      "name": "Supports Lipid Transport",
      "category": "Lipid Metabolism",
      "description": "Describes effects on the lipoproteins and transport proteins responsible for moving fats and cholesterol through the bloodstream.",
      "plainEnglish": "Helps the body move fats and cholesterol around efficiently.",
      "evidence": "Moderate",
      "primaryBodySystems": [
        "BS003"
      ],
      "maturity": "Established",
      "status": "Active"
    },
    {
      "id": "MEC008",
      "name": "Supports Lipid Oxidation",
      "category": "Lipid Metabolism",
      "description": "Covers the breakdown of fatty acids for energy within cells, particularly relevant to fat utilisation and metabolic efficiency.",
      "plainEnglish": "Helps the body burn fat for energy.",
      "evidence": "Moderate",
      "primaryBodySystems": [
        "BS003"
      ],
      "maturity": "Established",
      "status": "Active"
    },
    {
      "id": "MEC009",
      "name": "Supports Healthy Lipoprotein Balance",
      "category": "Lipid Metabolism",
      "description": "A broader mechanism describing effects on the overall balance between different lipoprotein classes (LDL, HDL, VLDL) that determine cardiovascular risk.",
      "plainEnglish": "Helps keep the different types of cholesterol-carrying particles in a healthy balance.",
      "evidence": "High",
      "primaryBodySystems": [
        "BS003"
      ],
      "maturity": "Established",
      "status": "Active"
    },
    {
      "id": "MEC010",
      "name": "Supports Endothelial Function",
      "category": "Vascular Function",
      "description": "Describes support for the health of the endothelium, the thin layer of cells lining blood vessels that regulates vascular tone, clotting and inflammation.",
      "plainEnglish": "Helps keep the inner lining of blood vessels healthy.",
      "evidence": "Moderate",
      "primaryBodySystems": [
        "BS003"
      ],
      "maturity": "Established",
      "status": "Active"
    },
    {
      "id": "MEC011",
      "name": "Supports Nitric Oxide Production",
      "category": "Vascular Function",
      "description": "Covers compounds that support the body's production of nitric oxide, a signalling molecule that relaxes blood vessels and improves blood flow.",
      "plainEnglish": "Helps the body produce nitric oxide, which relaxes blood vessels.",
      "evidence": "Moderate",
      "primaryBodySystems": [
        "BS003"
      ],
      "maturity": "Established",
      "status": "Active"
    },
    {
      "id": "MEC012",
      "name": "Supports Vascular Elasticity",
      "category": "Vascular Function",
      "description": "Describes effects on the flexibility of blood vessel walls, allowing them to expand and contract normally with each heartbeat.",
      "plainEnglish": "Helps keep blood vessels flexible and responsive.",
      "evidence": "High",
      "primaryBodySystems": [
        "BS003"
      ],
      "maturity": "Established",
      "status": "Active"
    },
    {
      "id": "MEC013",
      "name": "Supports Healthy Blood Pressure Regulation",
      "category": "Vascular Function",
      "description": "Covers the range of mechanisms, including vasodilation and reduced arterial stiffness, through which foods can support normal blood pressure.",
      "plainEnglish": "Helps support healthy blood pressure.",
      "evidence": "Moderate",
      "primaryBodySystems": [
        "BS003"
      ],
      "maturity": "Established",
      "status": "Active"
    },
    {
      "id": "MEC014",
      "name": "Supports Microcirculation",
      "category": "Vascular Function",
      "description": "Describes effects on blood flow through the smallest vessels, capillaries and arterioles, which supply oxygen and nutrients to tissues.",
      "plainEnglish": "Helps improve blood flow through the smallest blood vessels.",
      "evidence": "Moderate",
      "primaryBodySystems": [
        "BS003"
      ],
      "maturity": "Established",
      "status": "Active"
    },
    {
      "id": "MEC015",
      "name": "Supports Vascular Repair",
      "category": "Vascular Function",
      "description": "Covers processes involved in maintaining and repairing blood vessel walls following everyday wear or minor damage.",
      "plainEnglish": "Helps the body repair and maintain blood vessel walls.",
      "evidence": "High",
      "primaryBodySystems": [
        "BS003"
      ],
      "maturity": "Established",
      "status": "Active"
    },
    {
      "id": "MEC016",
      "name": "Supports Healthy Platelet Function",
      "category": "Vascular Function",
      "description": "Describes effects on platelet activity and aggregation, relevant to normal blood clotting and vascular health.",
      "plainEnglish": "Helps keep blood platelets functioning normally.",
      "evidence": "Moderate",
      "primaryBodySystems": [
        "BS003"
      ],
      "maturity": "Established",
      "status": "Active"
    },
    {
      "id": "MEC017",
      "name": "Supports Capillary Integrity",
      "category": "Vascular Function",
      "description": "Covers effects on the strength and permeability of capillary walls, the smallest blood vessels in the body.",
      "plainEnglish": "Helps keep the smallest blood vessels strong and less prone to leaking.",
      "evidence": "Moderate",
      "primaryBodySystems": [
        "BS003"
      ],
      "maturity": "Established",
      "status": "Active"
    },
    {
      "id": "MEC018",
      "name": "Supports Healthy Blood Flow",
      "category": "Vascular Function",
      "description": "A broader mechanism describing the combined vascular effects, including vessel dilation and reduced resistance, that support efficient blood flow throughout the body.",
      "plainEnglish": "Helps blood flow more easily around the body.",
      "evidence": "High",
      "primaryBodySystems": [
        "BS003"
      ],
      "maturity": "Established",
      "status": "Active"
    },
    {
      "id": "MEC019",
      "name": "Supports Vascular Resilience",
      "category": "Vascular Function",
      "description": "Describes the vascular system's overall capacity to withstand and recover from everyday physiological stress, such as blood pressure fluctuations.",
      "plainEnglish": "Helps blood vessels stay resilient under everyday stress.",
      "evidence": "Moderate",
      "primaryBodySystems": [
        "BS003"
      ],
      "maturity": "Established",
      "status": "Active"
    },
    {
      "id": "MEC020",
      "name": "Reduces Oxidative Stress",
      "category": "Oxidative Stress",